[
  {
    "test_id": "OBLIG-001",
    "category": "obligation_enforcement",
    "policy_file": "policies/test_obligations_missing.yaml",
    "registry_file": "registries/test_registry_no_rollback.yaml",
    "action_proposal": {
      "action_id": "ob1",
      "incident_id": "inc-1",
      "action_class": "cad_update.address",
      "proposed_payload": {
        "location": "123 Main St",
        "city": "Vancouver"
      },
      "evidence_refs": [
        {
          "type": "transcript_span",
          "category": "human_communication",
          "source": "turn:1",
          "content": "caller says address",
          "confidence": 0.95
        }
      ],
      "uncertainty": {
        "p_correct": 0.95,
        "conflict": false
      },
      "read_set": {
        "record_version": 0,
        "field_versions": {
          "location": 0,
          "city": 0
        }
      },
      "proposer": {
        "agent_id": "911buddy",
        "agent_role": "dsa",
        "autonomy_level": "A3"
      }
    },
    "expected": {
      "policy_error": "missing_audit_operator"
    },
    "deterministic": true
  },
  {
    "test_id": "OBLIG-002",
    "category": "obligation_enforcement",
    "policy_file": "policies/test_policy_missing_a3_guard.yaml",
    "registry_file": "registries/test_registry_no_rollback.yaml",
    "action_proposal": {
      "action_id": "ob2",
      "incident_id": "inc-1",
      "action_class": "cad_update.address",
      "proposed_payload": {
        "location": "123 Main St",
        "city": "Vancouver"
      },
      "evidence_refs": [
        {
          "type": "transcript_span",
          "category": "human_communication",
          "source": "turn:1",
          "content": "caller says address",
          "confidence": 0.95
        }
      ],
      "uncertainty": {
        "p_correct": 0.95,
        "conflict": false
      },
      "read_set": {
        "record_version": 0,
        "field_versions": {
          "location": 0,
          "city": 0
        }
      },
      "proposer": {
        "agent_id": "911buddy",
        "agent_role": "dsa",
        "autonomy_level": "A3"
      }
    },
    "expected": {
      "policy_error": "missing_rollback_or_checkpoint_for_A3"
    },
    "deterministic": true
  },
  {
    "test_id": "OBLIG-003",
    "category": "obligation_enforcement",
    "policy_file": "policies/test_policy_missing_a4_escalate.yaml",
    "registry_file": "registries/test_registry_a4_with_rollback.yaml",
    "action_proposal": {
      "action_id": "ob3",
      "incident_id": "inc-1",
      "action_class": "nlp.translate_stream",
      "proposed_payload": {
        "source_lang": "pa",
        "target_lang": "en",
        "text": "meri madad karo"
      },
      "evidence_refs": [
        {
          "type": "transcript_span",
          "category": "human_communication",
          "source": "turn:1",
          "content": "need translation",
          "confidence": 0.9
        }
      ],
      "uncertainty": {
        "p_correct": 0.9,
        "conflict": false
      },
      "read_set": {
        "record_version": 0,
        "field_versions": {}
      },
      "proposer": {
        "agent_id": "translator",
        "agent_role": "translation",
        "autonomy_level": "A4"
      }
    },
    "expected": {
      "policy_error": "missing_escalation_for_A4"
    },
    "deterministic": true
  },
  {
    "test_id": "OBLIG-004",
    "category": "obligation_enforcement",
    "policy_file": "policies/test_full_ecc.yaml",
    "registry_file": "registries/test_registry.yaml",
    "action_proposal": {
      "action_id": "ob4",
      "incident_id": "inc-1",
      "action_class": "nlp.translate_stream",
      "proposed_payload": {
        "source_lang": "pa",
        "target_lang": "en",
        "text": "meri madad karo"
      },
      "evidence_refs": [
        {
          "type": "transcript_span",
          "category": "human_communication",
          "source": "turn:1",
          "content": "need translation",
          "confidence": 0.9
        }
      ],
      "uncertainty": {
        "p_correct": 0.9,
        "conflict": false
      },
      "read_set": {
        "record_version": 0,
        "field_versions": {}
      },
      "proposer": {
        "agent_id": "translator",
        "agent_role": "translation",
        "autonomy_level": "A4"
      }
    },
    "plant_state": {
      "cad_state": {},
      "record_version": 0,
      "field_versions": {
        "location": 0,
        "city": 0,
        "cross_streets": 0,
        "narrative": 0,
        "caller_phone_number": 0
      }
    },
    "checkpoint_shim": "auto_approve",
    "context_snapshot": {
      "transcript_turns": [
        1,
        2,
        3,
        4,
        5
      ],
      "sop_ids": [
        "fire-res-v2",
        "common-v1"
      ]
    },
    "expected": {
      "decision": "executed"
    },
    "deterministic": false
  },
  {
    "test_id": "OBLIG-005",
    "category": "obligation_enforcement",
    "policy_file": "policies/test_obligations_a2_checkpoint.yaml",
    "registry_file": "registries/test_registry.yaml",
    "action_proposal": {
      "action_id": "ob5",
      "incident_id": "inc-1",
      "action_class": "cad_update.address",
      "proposed_payload": {
        "location": "123 Main St",
        "city": "Vancouver"
      },
      "evidence_refs": [
        {
          "type": "transcript_span",
          "category": "human_communication",
          "source": "turn:1",
          "content": "caller says address",
          "confidence": 0.95
        }
      ],
      "uncertainty": {
        "p_correct": 0.95,
        "conflict": false
      },
      "read_set": {
        "record_version": 0,
        "field_versions": {
          "location": 0,
          "city": 0
        }
      },
      "proposer": {
        "agent_id": "911buddy",
        "agent_role": "dsa",
        "autonomy_level": "A2"
      }
    },
    "plant_state": {
      "cad_state": {},
      "record_version": 0,
      "field_versions": {
        "location": 0,
        "city": 0,
        "cross_streets": 0,
        "narrative": 0,
        "caller_phone_number": 0
      }
    },
    "checkpoint_shim": "auto_approve",
    "context_snapshot": {
      "transcript_turns": [
        1,
        2,
        3,
        4,
        5
      ],
      "sop_ids": [
        "fire-res-v2",
        "common-v1"
      ]
    },
    "expected": {
      "decision": "executed",
      "checkpoint_invoked": true
    },
    "deterministic": true
  },
  {
    "test_id": "OBLIG-006",
    "category": "obligation_enforcement",
    "policy_file": "policies/test_permissive.yaml",
    "registry_file": "registries/test_registry.yaml",
    "action_proposal": {
      "action_id": "ob6",
      "incident_id": "inc-1",
      "action_class": "cad_update.address",
      "proposed_payload": {
        "location": "123 Main St",
        "city": "Vancouver"
      },
      "evidence_refs": [
        {
          "type": "transcript_span",
          "category": "human_communication",
          "source": "turn:1",
          "content": "caller says address",
          "confidence": 0.95
        }
      ],
      "uncertainty": {
        "p_correct": 0.8,
        "conflict": false
      },
      "read_set": {
        "record_version": 0,
        "field_versions": {
          "location": 0,
          "city": 0
        }
      },
      "proposer": {
        "agent_id": "911buddy",
        "agent_role": "dsa",
        "autonomy_level": "A3"
      }
    },
    "plant_state": {
      "cad_state": {},
      "record_version": 0,
      "field_versions": {
        "location": 0,
        "city": 0,
        "cross_streets": 0,
        "narrative": 0,
        "caller_phone_number": 0
      }
    },
    "checkpoint_shim": "auto_approve",
    "context_snapshot": {
      "transcript_turns": [
        1,
        2,
        3,
        4,
        5
      ],
      "sop_ids": [
        "fire-res-v2",
        "common-v1"
      ]
    },
    "expected": {
      "decision": "executed"
    },
    "deterministic": true
  }
]